{
  "contractVersion": "1.0.0",
  "kind": "signature-vectors",
  "schemaVersion": "1.0.0",
  "vectors": [
    {
      "expected": "VALID",
      "id": "S-001",
      "messageUtf8": "{\"TransactionId\":\"d4a2f9c1-3b5e-4f6a-9c7d-2e8f1a0b3c4d\",\"PayloadKind\":\"351cd60b-3fdf-48d4-b608-e93c0100f7d0\",\"TransactionTimeStamp\":\"2026-08-01T12:34:56.789Z\",\"Payload\":{\"IdentityAlias\":\"public-test-alias-001\",\"PublicSigningAddress\":\"0237fdd4364c0b898908be2f1a98a6b4a7890c623ae92a283640e44d87e048daa5\",\"PublicEncryptAddress\":\"032ebaf076203f15ac8119cfdbc9394d1c7b9929b0647e4f607e27da95701f8556\",\"IsPublic\":true},\"PayloadSize\":241}",
      "messageUtf8Hex": "7b225472616e73616374696f6e4964223a2264346132663963312d336235652d346636612d396337642d326538663161306233633464222c225061796c6f61644b696e64223a2233353163643630622d336664662d343864342d623630382d653933633031303066376430222c225472616e73616374696f6e54696d655374616d70223a22323032362d30382d30315431323a33343a35362e3738395a222c225061796c6f6164223a7b224964656e74697479416c696173223a227075626c69632d746573742d616c6961732d303031222c225075626c69635369676e696e6741646472657373223a22303233376664643433363463306238393839303862653266316139386136623461373839306336323361653932613238333634306534346438376530343864616135222c225075626c6963456e637279707441646472657373223a22303332656261663037363230336631356163383131396366646263393339346431633762393932396230363437653466363037653237646139353730316638353536222c2249735075626c6963223a747275657d2c225061796c6f616453697a65223a3234317d",
      "notes": "Fixed deterministic (RFC 6979) P-01 compact r||s signature; DER form also verifies.",
      "operation": "VERIFY",
      "producerId": "P-01",
      "publicKeyHex": "0237fdd4364c0b898908be2f1a98a6b4a7890c623ae92a283640e44d87e048daa5",
      "signatureCompactBase64": "uizMd0ZbEjaknGg58OjDBsxp+y0maChiyYSPGB6NsPp/jtIYqVb5GPqQJYRlOCt5ISONDc30/dB2cA3AKEs7Qw==",
      "signatureCompactHex": "ba2ccc77465b1236a49c6839f0e8c306cc69fb2d26682862c9848f181e8db0fa7f8ed218a956f918fa90258465382b7921238d0dcdf4fdd076700dc0284b3b43",
      "signatureDerHex": "304100ba2ccc77465b1236a49c6839f0e8c306cc69fb2d26682862c9848f181e8db0fa7f8ed218a956f918fa90258465382b7921238d0dcdf4fdd076700dc0284b3b43"
    },
    {
      "expected": "VALID",
      "id": "S-002",
      "messageUtf8": "{\"TransactionId\":\"d4a2f9c1-3b5e-4f6a-9c7d-2e8f1a0b3c4d\",\"PayloadKind\":\"351cd60b-3fdf-48d4-b608-e93c0100f7d0\",\"TransactionTimeStamp\":\"2026-08-01T12:34:56.789Z\",\"Payload\":{\"IdentityAlias\":\"public-test-alias-001\",\"PublicSigningAddress\":\"0237fdd4364c0b898908be2f1a98a6b4a7890c623ae92a283640e44d87e048daa5\",\"PublicEncryptAddress\":\"032ebaf076203f15ac8119cfdbc9394d1c7b9929b0647e4f607e27da95701f8556\",\"IsPublic\":true},\"PayloadSize\":241}",
      "messageUtf8Hex": "7b225472616e73616374696f6e4964223a2264346132663963312d336235652d346636612d396337642d326538663161306233633464222c225061796c6f61644b696e64223a2233353163643630622d336664662d343864342d623630382d653933633031303066376430222c225472616e73616374696f6e54696d655374616d70223a22323032362d30382d30315431323a33343a35362e3738395a222c225061796c6f6164223a7b224964656e74697479416c696173223a227075626c69632d746573742d616c6961732d303031222c225075626c69635369676e696e6741646472657373223a22303233376664643433363463306238393839303862653266316139386136623461373839306336323361653932613238333634306534346438376530343864616135222c225075626c6963456e637279707441646472657373223a22303332656261663037363230336631356163383131396366646263393339346431633762393932396230363437653466363037653237646139353730316638353536222c2249735075626c6963223a747275657d2c225061796c6f616453697a65223a3234317d",
      "notes": "P-02 producer signing the same canonical message; verified with uncompressed key. .NET generates a random nonce, so exact bytes need not match across runtimes; cross-verification is the contract.",
      "operation": "VERIFY",
      "producerId": "P-02",
      "publicKeyHex": "042b347a16473bab675d469b6094deb96cd21239b855b98f98a4f8194953988306f9a5c50de7d68eb543364cbca033c05201a7cc93e96b61a8fb95402bc6e3b66e",
      "signatureCompactBase64": "455jefCoaONg4imRqNMvhLbmWvs/wRzJlRMJFhakFzVBNksAQsNe5/GJM7pCtYEocdxpVjj/Hh04sIKNsXjVJw==",
      "signatureCompactHex": "e39e6379f0a868e360e22991a8d32f84b6e65afb3fc11cc99513091616a4173541364b0042c35ee7f18933ba42b5812871dc695638ff1e1d38b0828db178d527",
      "signatureDerHex": "304100e39e6379f0a868e360e22991a8d32f84b6e65afb3fc11cc99513091616a4173541364b0042c35ee7f18933ba42b5812871dc695638ff1e1d38b0828db178d527"
    },
    {
      "expected": "INVALID",
      "id": "S-003",
      "messageUtf8": "{\"TransactionId\":\"d4a2f9c1-3b5e-4f6a-9c7d-2e8f1a0b3c4d\",\"PayloadKind\":\"351cd60b-3fdf-48d4-b608-e93c0100f7d0\",\"TransactionTimeStamp\":\"2026-08-01T12:34:56.790Z\",\"Payload\":{\"IdentityAlias\":\"public-test-alias-001\",\"PublicSigningAddress\":\"0237fdd4364c0b898908be2f1a98a6b4a7890c623ae92a283640e44d87e048daa5\",\"PublicEncryptAddress\":\"032ebaf076203f15ac8119cfdbc9394d1c7b9929b0647e4f607e27da95701f8556\",\"IsPublic\":true},\"PayloadSize\":241}",
      "messageUtf8Hex": "7b225472616e73616374696f6e4964223a2264346132663963312d336235652d346636612d396337642d326538663161306233633464222c225061796c6f61644b696e64223a2233353163643630622d336664662d343864342d623630382d653933633031303066376430222c225472616e73616374696f6e54696d655374616d70223a22323032362d30382d30315431323a33343a35362e3739305a222c225061796c6f6164223a7b224964656e74697479416c696173223a227075626c69632d746573742d616c6961732d303031222c225075626c69635369676e696e6741646472657373223a22303233376664643433363463306238393839303862653266316139386136623461373839306336323361653932613238333634306534346438376530343864616135222c225075626c6963456e637279707441646472657373223a22303332656261663037363230336631356163383131396366646263393339346431633762393932396230363437653466363037653237646139353730316638353536222c2249735075626c6963223a747275657d2c225061796c6f616453697a65223a3234317d",
      "notes": "Wrong message (timestamp tampered).",
      "operation": "VERIFY",
      "publicKeyHex": "0237fdd4364c0b898908be2f1a98a6b4a7890c623ae92a283640e44d87e048daa5",
      "signatureCompactBase64": "uizMd0ZbEjaknGg58OjDBsxp+y0maChiyYSPGB6NsPp/jtIYqVb5GPqQJYRlOCt5ISONDc30/dB2cA3AKEs7Qw=="
    },
    {
      "expected": "INVALID",
      "id": "S-004",
      "messageUtf8": "{\"TransactionId\":\"d4a2f9c1-3b5e-4f6a-9c7d-2e8f1a0b3c4d\",\"PayloadKind\":\"351cd60b-3fdf-48d4-b608-e93c0100f7d0\",\"TransactionTimeStamp\":\"2026-08-01T12:34:56.789Z\",\"Payload\":{\"IdentityAlias\":\"public-test-alias-001\",\"PublicSigningAddress\":\"0237fdd4364c0b898908be2f1a98a6b4a7890c623ae92a283640e44d87e048daa5\",\"PublicEncryptAddress\":\"032ebaf076203f15ac8119cfdbc9394d1c7b9929b0647e4f607e27da95701f8556\",\"IsPublic\":true},\"PayloadSize\":241}",
      "messageUtf8Hex": "7b225472616e73616374696f6e4964223a2264346132663963312d336235652d346636612d396337642d326538663161306233633464222c225061796c6f61644b696e64223a2233353163643630622d336664662d343864342d623630382d653933633031303066376430222c225472616e73616374696f6e54696d655374616d70223a22323032362d30382d30315431323a33343a35362e3738395a222c225061796c6f6164223a7b224964656e74697479416c696173223a227075626c69632d746573742d616c6961732d303031222c225075626c69635369676e696e6741646472657373223a22303233376664643433363463306238393839303862653266316139386136623461373839306336323361653932613238333634306534346438376530343864616135222c225075626c6963456e637279707441646472657373223a22303332656261663037363230336631356163383131396366646263393339346431633762393932396230363437653466363037653237646139353730316638353536222c2249735075626c6963223a747275657d2c225061796c6f616453697a65223a3234317d",
      "notes": "Mutated signature (last byte flipped).",
      "operation": "VERIFY",
      "publicKeyHex": "0237fdd4364c0b898908be2f1a98a6b4a7890c623ae92a283640e44d87e048daa5",
      "signatureCompactBase64": "uizMd0ZbEjaknGg58OjDBsxp+y0maChiyYSPGB6NsPp/jtIYqVb5GPqQJYRlOCt5ISONDc30/dB2cA3AKEs7Qg==",
      "signatureCompactHex": "ba2ccc77465b1236a49c6839f0e8c306cc69fb2d26682862c9848f181e8db0fa7f8ed218a956f918fa90258465382b7921238d0dcdf4fdd076700dc0284b3b42"
    },
    {
      "expected": "INVALID",
      "id": "S-005",
      "messageUtf8": "{\"TransactionId\":\"d4a2f9c1-3b5e-4f6a-9c7d-2e8f1a0b3c4d\",\"PayloadKind\":\"351cd60b-3fdf-48d4-b608-e93c0100f7d0\",\"TransactionTimeStamp\":\"2026-08-01T12:34:56.789Z\",\"Payload\":{\"IdentityAlias\":\"public-test-alias-001\",\"PublicSigningAddress\":\"0237fdd4364c0b898908be2f1a98a6b4a7890c623ae92a283640e44d87e048daa5\",\"PublicEncryptAddress\":\"032ebaf076203f15ac8119cfdbc9394d1c7b9929b0647e4f607e27da95701f8556\",\"IsPublic\":true},\"PayloadSize\":241}",
      "messageUtf8Hex": "7b225472616e73616374696f6e4964223a2264346132663963312d336235652d346636612d396337642d326538663161306233633464222c225061796c6f61644b696e64223a2233353163643630622d336664662d343864342d623630382d653933633031303066376430222c225472616e73616374696f6e54696d655374616d70223a22323032362d30382d30315431323a33343a35362e3738395a222c225061796c6f6164223a7b224964656e74697479416c696173223a227075626c69632d746573742d616c6961732d303031222c225075626c69635369676e696e6741646472657373223a22303233376664643433363463306238393839303862653266316139386136623461373839306336323361653932613238333634306534346438376530343864616135222c225075626c6963456e637279707441646472657373223a22303332656261663037363230336631356163383131396366646263393339346431633762393932396230363437653466363037653237646139353730316638353536222c2249735075626c6963223a747275657d2c225061796c6f616453697a65223a3234317d",
      "notes": "Wrong public key (encryption key instead of signing key).",
      "operation": "VERIFY",
      "publicKeyHex": "032ebaf076203f15ac8119cfdbc9394d1c7b9929b0647e4f607e27da95701f8556",
      "signatureCompactBase64": "uizMd0ZbEjaknGg58OjDBsxp+y0maChiyYSPGB6NsPp/jtIYqVb5GPqQJYRlOCt5ISONDc30/dB2cA3AKEs7Qw=="
    },
    {
      "errorCode": "SIGNATURE_MALFORMED",
      "expected": "ERROR",